{"baseline":{"artifact_locator":"file:performance/fixtures/result-v1.valid.json","checksum_sha256":"0442f43b307030886214e5b57e7c25215d4333c7d12a78e550a4e57aef881d63","comparison_key":"feec2dfa68ad54fdbb25abbccd80c015d620b016760cf684c275761621a3db2d","identity":{"benchmark_id":"runtime.session.launch","build_mode":"release","environment_class":"macos-arm64-m4","fixture":{"cardinality":4,"id":"launch-v1","sha256":"1111111111111111111111111111111111111111111111111111111111111111"},"hardware":"MacBookPro M4 16GB","measurement_availability":{"cpu_time_ns":"available","peak_rss_bytes":"available"},"os":"macOS 26.0","power_state":"ac","protocol":{"outlier_policy":"tukey_upper_3_iqr_v1","per_sample_deadline_ns":5000000000,"run_deadline_ns":60000000000,"sample_count":4,"warmup_count":1},"reset_scopes":["runtime_store","artifact_cache"],"state":"warm","thermal_state":"nominal","toolchain":"rustc 1.88.0"},"source_provenance":"git:https://github.com/pablof7z/nampplets","source_revision":"2222222222222222222222222222222222222222"},"candidate":{"artifact_locator":"file:performance/fixtures/result-v1.valid.json","checksum_sha256":"0442f43b307030886214e5b57e7c25215d4333c7d12a78e550a4e57aef881d63","comparison_key":"feec2dfa68ad54fdbb25abbccd80c015d620b016760cf684c275761621a3db2d","identity":{"benchmark_id":"runtime.session.launch","build_mode":"release","environment_class":"macos-arm64-m4","fixture":{"cardinality":4,"id":"launch-v1","sha256":"1111111111111111111111111111111111111111111111111111111111111111"},"hardware":"MacBookPro M4 16GB","measurement_availability":{"cpu_time_ns":"available","peak_rss_bytes":"available"},"os":"macOS 26.0","power_state":"ac","protocol":{"outlier_policy":"tukey_upper_3_iqr_v1","per_sample_deadline_ns":5000000000,"run_deadline_ns":60000000000,"sample_count":4,"warmup_count":1},"reset_scopes":["runtime_store","artifact_cache"],"state":"warm","thermal_state":"nominal","toolchain":"rustc 1.88.0"},"source_provenance":"git:https://github.com/pablof7z/nampplets","source_revision":"2222222222222222222222222222222222222222"},"checksum_sha256":"d9ad186d30623021e7aa30d2bf3b308f24e9fbc072cf523d6c2a46e1036a20c0","comparison_id":"fixture-comparison-v1","confidence":{"disposition":"not_evaluated","reason":{"code":"no_ratified_method","detail":"No confidence method is ratified for this observed-only fixture."}},"producer_summary":{"disposition":"observed_only","mismatch_codes":[]},"schema_id":"urn:nampplets:performance:comparison:v1"}